variable_1,variable_2,variable_3
"Gẹgẹ bi oju ewe naa, kini a o pe ni ojulowo itọni fun imọ titẹ àkọdiọnu daadaa?

A) Fun afikun iwọn didun, lo agbara pipọ pẹlu eyiti o lu awọn bọtini naa
B) Maṣe maa rin ainidi kiri ki o le ni okun si
C) Ṣe akiyesi lilu awọn nooti lakoko mimu ọwọ rẹ rọ
D) Mu iyara pọ si pẹlu eyi ti o fi ṣẹ awọn ohun agbara isalẹ lati ṣaṣeyọri iwọn didun afikun",Rí i dájú pé ọwọ́ rẹ ní ìsinmi bó se yẹ nígbàtí o bá ń kọlu gbogbo àkíyèsí tí ó tó - pẹ̀lú pé ki o má dààmú ọmọ ìka ọwọ́ rẹ jùlọ. Bó ba n ṣe báyí kò ní rẹ̀ ẹ́ jù. Rántí pé o kò níláti fi agbára tẹ ojú rẹ̀ kí ohun rẹ̀ ga síi bí ti piano. Láti mú ohun akodioni tóbi si wàá lò àwọn belò pẹ̀lú agbára tàbí ere sí i.,"A) Fun afikun iwọn didun, lo agbara pipọ pẹlu eyiti o lu awọn bọtini naa"
